UF_Id;Munic_Id;Munic_Id6;Munic_Nome;Pop2018;ExtremWest_Adress;ExtremWest_Lat;ExtremWest_Lon;ExtremEast_Adress;ExtremEast_Lat;ExtremEast_Lon;ExtremSouth_Adress;ExtremSouth_Lat;ExtremSouth_Lon;ExtremNorth_Adress;ExtremNorth_Lat;ExtremNorth_Lon;Center_Adress;Center_Lat;Center_Lon
35;3550308;355030;SÃO PAULO;12176866;Av. Guilherme Fongaro, 374 - Jardim Arpoador, São Paulo - SP, 05576-100;-23,5932963;-46,8079606;Avenida Marechal Tito, 7579 - Itaim Paulista, São Paulo - SP, 08115-100;-23,4859244;-46,3800909;Estr. da Col., 95 - Parelheiros, São Paulo - SP, 04892-000;-23,831669;-46,737041;Rod. Fernão Dias, 23200 - Tres Cruzes, São Paulo - SP, 02284-000;-23,4087326;-46,5825467;Praça da Sé, 108 - Sé, São Paulo - SP, 01001-001;-23,549941;-46,634255
33;3304557;330455;RIO DE JANEIRO;6688927;R. Alceu Ferreira Viveiros, 287-251 - Santa Cruz, Rio de Janeiro - RJ, 23560-360;-22,901562;-43,712495;Av. Alm. Silvio de Noronha, 365 - Centro, Rio de Janeiro - RJ, 20021-010;-22,91419;-43,16637;Av. Vieira Souto, 1770 - Ipanema, Rio de Janeiro - RJ, 22420-008;-22,98688;-43,210796;Largo da Pavuna, 97-1 - Pavuna, Rio de Janeiro - RJ, 21520-310;-22,805991;-43,366999;Av. Rio Branco, 156 - Centro, Rio de Janeiro - RJ, 20040-972;-22,907024;-43,177577
53;5300108;530010;BRASÍLIA;2974703;St. R Qnr 05 conjunto M casa 01, St. R - Ceilândia, Brasília - DF, 72275-676;-15,794744;-48,162792;SHTN Trecho 1 - Lago Paranoá, Brasília - DF, 70297-400;-15,788681;-47,829254;QR 201 CL 201 - Santa Maria, Brasília - DF;-16,042011;-48,033853;Q. 9 Conjunto F - Q 9 - Sobradinho, Brasília - DF;-15,641228;-47,808723;Esplanada dos Ministérios lote 12 - Brasília, DF, 70050-000;-15,798249;-47,875572
29;2927408;292740;SALVADOR;2857329;Av. Lafayete Coutinho, 1010 - 01 - Comercio, Salvador - BA, 40015-160;-12,980272;-38,5243962;R. Santa Cecília, 112 - Jardim das Margaridas, Salvador - BA, 41502-335;-12,9000111;-38,3561807;Av. Oceânica - Barra, Salvador - BA, 41140-130;-13,0073031;-38,5259344;R. Benjamin de Souza - São Tomé de Paripe, Salvador - BA, 40800-201;-12,8255539;-38,4830051;R. Manoel Vitórino, 46 - Comercio, Salvador - BA, 40020-015;-12,976763;-38,515892
23;2304400;230440;FORTALEZA;2643247;Av. Presidente Castelo Branco, 6417 - Barra do Ceará, Fortaleza - CE, 60170-002;-3,7004428;-38,5877086;Av. Clóvis Arrais Maia, 4987 - Antonio Diogo, Fortaleza - CE, 60183-692;-3,745297;-38,4638259;Av. Dr. Mendel Steinbruch, 6818 - Parangaba, Fortaleza - CE;-3,8376808;-38,583514;Rua dos Tabajaras, 340 - Praia de Iracema, Fortaleza - CE, 60060-510;-3,728443;-38,5292816;R. Dragão do Mar, 81 - Praia de Iracema, Fortaleza - CE, 60060-390;-3,721307;-38,520554
31;3106200;310620;BELO HORIZONTE;2501576;Rua Flor de Jambo, 62 - Jardim Filadelfia, Belo Horizonte - MG, 30865-290;-19,9210726;-44,0235285;R. Itaguá, 320 - Alto Vera Cruz, Belo Horizonte - MG, 30285-260;-19,9053542;-43,8946003;R. Sra. do Carmo, 161 - Olhos D'Água, Belo Horizonte - MG, 30390-170;-19,9903359;-43,9633528;Alameda Interligação, 410 - Serra Verde, Belo Horizonte - MG, 31630-120;-19,799798;-43,952399;Av. Augusto de Lima, 744 - Centro, Belo Horizonte - MG, 30190-922;-19,923122;-43,943185
13;1302603;130260;MANAUS;2145444;Av. Coronel Teixeira, 10507 - Ponta Negra, Manaus - AM, 69030-480;-3,050879;-60,113919;Av. Leste, 68 A - Mauazinho, Manaus - AM, 69075-330;-3,122588;-59,936715;R. Barão de São Domingos, 295 - Centro, Manaus - AM, 69005-010;-3,141387;-60,020941;Avenida Arquiteto José Henrique Bento Rodrigues, 3760 - Monte das Oliveiras, Manaus - AM, 69093-149;-2,9654779;-60,0310879;Av. Eduardo Ribeiro, 901 - Centro, Manaus - AM, 69400-901;-3,130228;-60,024149
41;4106902;410690;CURITIBA;1917185;R. Eduardo Sprada, 5806-5850 - Cidade Industrial De Curitiba, Curitiba - PR, 81290-000;-25,451495;-49,359259;Av. Victor Ferreira do Amaral, 3800 - Tarumã, Curitiba - PR, 82810-350;-25,431356;-49,204908;R. Orestes Códega, 165 - Pinheirinho, Curitiba - PR, 81150-200;-25,523711;-49,29764;Av. Anita Garibaldi, 2884 - Boa Vista, Curitiba - PR, 82210-000;-25,387134;-49,26084;R. André de Barros, 48 - Centro, Curitiba - PR, 80010-090;-25,436201;-49,272133
26;2611606;261160;RECIFE;1637834;R. Inaldo Bartolomeu de Carvalho, 89-55 - Várzea, Recife - PE, 50970-360;-8,035368;-34,979259;Av. Alfredo Lisboa, 810 - Recife, PE, 50030-150;-8,059061;-34,869444;Av. Boa Viagem, 58 - Boa Viagem, Recife - PE, 51130-020;-8,151494;-34,908181;R. Farias Neves - Campo Grande, Recife - PE, 52040-320;-8,022428;-34,877378;Av. Alfredo Lisboa, 172 - Recife, PE, 50030-150;-8,062244;-34,870993
52;5208707;520870;GOIÂNIA;1495705;Av. Anhanguera, 14404 - Capuava, Goiânia - GO, 74450-010;-16,6575718;-49,3312871;Av. Dep. Jamel Cecílio, 3300 - Jardim Goiás, Goiânia - GO, 74810-907;-16,7066039;-49,2342219;Av. Rio Verde, 102/104 - Piso 1 - Vila Sao Tomaz, Aparecida de Goiânia - GO, 74915-515;-16,741135;-49,276299;R. OM Doze - Res. Orlando de Morais, Goiânia - GO;-16,559983;-49,2716;R. 10, Nº 180 - St. Sul, Goiânia - GO, 74080-420;-16,679713;-49,252817
15;1501402;150140;BELÉM;1485732;Praça Dom Frei Caetano Brandão - Cidade Velha, Belém - PA, 66020-310;-1,4600852;-48,5025687;Rodovia BR-316, Km 01, 1550A - Castanheira, Belém - PA, 66645-000;-1,4035666;-48,4278455;Av. Bernardo Sayão, 4946 - 3 - Guamá, Belém - PA, 66075-155;-1,4756619;-48,4650972;Av. Beira-Mar, 4093-3993 - São João do Outeiro, Belém - PA, 66840-050;-1,256937;-48,468968;Av. Blvd. Castilhos França, 168 B - Campina, Belém - PA, 66013-030;-1,451803;-48,502805
43;4314902;431490;PORTO ALEGRE;1479101;Av. Mauá, 655-699 - Centro Histórico, Porto Alegre - RS, 90010-110;-30,029456;-51,235603;Av. Protásio Alves, 10813-10847 - Alto Petrópolis, Porto Alegre - RS;-30,041298;-51,103886;Av. Juca Batista, 7570 - Belém Novo, Porto Alegre - RS, 91780-070;-30,1438909;-51,2461335;Av. Padre Leopoldo Brentano, 110 - Humaitá, Porto Alegre - RS, 90250-590;-29,9918263;-51,1561637;R. Gen. Salustiano, 392 - Centro Histórico, Porto Alegre - RS, 90010-290;-30,035264;-51,240083
35;3518800;351880;GUARULHOS;1365899;R. Santiago Neto, 59 - Vila Itapegica, Guarulhos - SP, 07053-123;-23,47738;-46,55941;R. Tenry, 115 - Vila Nova Bonsucesso, Guarulhos - SP, 07176-361;-23,404378;-46,386583;Av. Aniello Pratici, 230 - Centro, Guarulhos - SP;-23,482897;-46,528017;R. Maria Guilhermina, 620 - Jardim Monte Alto, Guarulhos - SP, 07075-245;-23,399464;-46,537188;R. dos Crisântemos, 29 - Vila Tijuco, Guarulhos - SP, 07091-060;-23,465273;-46,536267
35;3509502;350950;CAMPINAS;1194094;R. Juvenal Fernandes, 1529-1391 - Conj. Hab. Parque da Floresta, Campinas - SP;-22,957664;-47,203075;SP-081, 715-313 - Joaquim Egídio, Campinas - SP, 13108-002;-22,88178;-46,951736;R. Eldorado, 440 - Jardim Itatinga, Campinas - SP, 13052-450;-22,98285;-47,105976;R. Maria Antônia Bicego, 1-35 - Jardim Myrian Moreira da Costa, Campinas - SP, 13098-420;-22,811404;-47,034202;Av. Dr. Moraes Sales, 416 - Centro, Campinas - SP, 13010-001;-22,908238;-47,060183
21;2111300;211130;SÃO LUÍS;1094667;Av. Sen. Vitorino Freire, 6744-6950 - Centro, São Luís - MA, 65065-545;-2,531168;-44,307183;R. Três, 862-934 - Cohatrac II, São Luís - MA, 65054-400;-2,538573;-44,203736;R. do Arame, 1448-1528 - Cidade Operária, São Luís - MA;-2,613116;-44,198108;Av. Litorânea, 13b - Calhau, São Luís - MA, 65071-630;-2,483707;-44,26238;Av. Dom Pedro ll, 78 - Centro, São Luís - MA, 65010-450;-2,527734;-44,306752
33;3304904;330490;SÃO GONÇALO;1077687;R. Oliveira Botelho, 377 - Neves, São Gonçalo - RJ, 24425-005;-22,857105;-43,099573;Av. Pres. Roosevelt, 885 - Bom Retiro, São Gonçalo - RJ, 24722-110;-22,8032777;-42,9633323;R. Basileia, 254 - Engenho Pequeno, São Gonçalo - RJ, 24417-320;-22,850558;-43,048866;Estr. das Palmeiras, 716-818 - Fazenda dos Mineiros, São Gonçalo - RJ, 24471-190;-22,782095;-43,043995;R. Felíciano Sodré, 100 - Centro, São Gonçalo - RJ, 24440-440;-22,824965;-43,049242
27;2704302;270430;MACEIÓ;1012382;Av. Sen. Arnon Mello, 427 - Pontal da Barra, Maceió - AL, 57073-570;-9,695833;-35,777698;291, R. Sen. Ezechias Jerônimo da Rocha, 153 - Cruz das Almas, Maceió - AL, 57038-010;-9,626766;-35,695027;Av. Dr. Antônio Gouveia, 1447 - Pajuçara, Maceió - AL, 57030-170;-9,664248;-35,709128;Av. Tancredo Neves, 450 - Cidade Universitária, Maceió - AL, 57073-382;-9,5400652;-35,7554908;R. Sá e Albuquerque, 235 - Jaraguá, Maceió - AL, 57022-180;-9,672863;-35,721803
33;3301702;330170;DUQUE DE CAXIAS;914383;R. Covanca, 66 - Bar Cavalheiros, Duque de Caxias - RJ, 25025-500;-22,787553;-43,326643;R. Cardeal Arcoverde, 38 - Pqe Duque Caxias, Duque de Caxias - RJ, 25085-270;-22,795934;-43,285108;R. José de Alvarenga, 27620 - Centro, Duque de Caxias - RJ;-22,79802;-43,310293;Av. Tiradentes, 20 - Xerém, Duque de Caxias - RJ, 25250-130;-22,598442;-43,292965;Av. Gen. Rondon - Vila Leopoldina, Duque de Caxias - RJ, 25060-236;-22,763128;-43,303829
50;5002704;500270;CAMPO GRANDE;885711;R. Calaveras, 563-479 - Bosque Santa Monica, Campo Grande - MS, 79106-260;-20,455405;-54,712924;Av. Min. João Arinos, 6000 - Tiradentes, Campo Grande - MS;-20,463087;-54,55916;Av. Gury Marques, 8371 - Jardim Santa Felicidade, Campo Grande - MS, 79072-000;-20,575378;-54,583978;MS-010, 5482-5548 - Vila Nasser, Campo Grande - MS, 79118-580;-20,412522;-54,620831;Av. Afonso Pena, 2202 - Centro, Campo Grande - MS, 79002-908;-20,463921;-54,61551
24;2408102;240810;NATAL;877640;R. Ferro Cardoso, 150-2 - Guarapes, Natal - RN;-5,838799;-35,278206;R. João Rodrigues de Oliveira, 1 - Vila de Ponta Negra, Natal - RN, 59090-210;-5,883986;-35,165151;Av. Ayrton Senna, 3215 - Neópolis, Natal - RN, 59086-100;-5,8791094;-35,2054417;Av. Moema Tinoco da Cunha Lima, 4195 - Pajuçara, Natal - RN, 59133-090;-5,7168582;-35,2519954;R. Ulisses Caldas, 81 - Cidade Alta, Natal - RN, 59025-090;-5,784436;-35,207623
22;2211001;221100;TERESINA;861442;Rua Centauro B, 4540 - São Joaquim, Teresina - PI, 64004-070;-5,0561756;-42,8320243;Av. São Gonçalo, 4711 - Verde Lar, Teresina - PI, 64071-490;-5,0428475;-42,7427138;Av. 2 - Esplanada, Teresina - PI;-5,19857;-42,746554;Av. Poty Velho, 6262-6264 - Santa Rosa, Teresina - PI;-4,975779;-42,848262;Av. Antonino Freire, 1450 - Centro (Sul), Teresina - PI, 64001-040;-5,090818;-42,811848
35;3548708;354870;SÃO BERNARDO DO CAMPO;833240;R. Timóteo da Silva, 261 - Alvarenga, São Bernardo do Campo - SP;-23,747406;-46,63174;R. dos Vianas, 4015-4007 - Santa Terezinha, São Bernardo do Campo - SP, 09780-250;-23,704875;-46,518776;R. Bela Vista, 129 - Batistini, São Bernardo do Campo - SP, 09843-095;-23,7754813;-46,5970385;Av. Kennedy, 700 - Jardim do Mar, São Bernardo do Campo - SP, 09726-253;-23,6887041;-46,5816082;Av. Lucas Nogueira Garcez, 35 - Centro, São Bernardo do Campo - SP, 09750-670;-23,696189;-46,552813
33;3303500;330350;NOVA IGUAÇU;818875;Av. A, 887 - Conjunto Parque das Palmeiras - Palhada, Nova Iguaçu - RJ, 26290-375;-22,7508919;-43,5316696;R. Damas Batista, 645 - Prata, Nova Iguaçu - RJ, 26010-390;-22,7472021;-43,4351527;Av. Abílio Augusto Távora, 1111 - Jardim Alvorada, Nova Iguaçu - RJ, 26260-045;-22,7541172;-43,4842886;R. Jupura, 339 - Jardim Santa Rita, Nova Iguaçu - RJ, 26050-010;-22,689621;-43,46927;Av. Mal. Floriano Peixoto - Centro, Nova Iguaçu - RJ, 26210-060;-22,760289;-43,450348
25;2507507;250750;JOÃO PESSOA;800323;Av. Gal Aurélio de Lyra Tavares, 1892-1930 - Ilha do Bpo., João Pessoa - PB;-7,12908;-34,902569;Av. Cabo Branco, 1108 - Cabo Branco, João Pessoa - PB, 58045-010;-7,119585;-34,823853;R. Emb. Sérgio Viêira de Melo, 2298-2438 - Gramame, João Pessoa - PB;-7,210972;-34,878381;Av. Arthur Monteiro de Paiva, 808-960 - Bessa, João Pessoa - PB, 58035-010;-7,061363;-34,842237;Parque Sólon de Lucena, 563 - Centro, João Pessoa - PB, 58013-130;-7,1185;-34,878522
35;3547809;354780;SANTO ANDRÉ;716109;Avenida Lauro Gomes, 4940 - Vila Palmares, Santo André - SP, 09060-870;-23,650219;-46,565776;Rua Giovanni Battista Pirelli, 1980 - Vila Homero Thon, Santo André - SP, 09111-340;-23,664697;-46,489877;R. Rio Jaguaribe, 535-465 - Jardim Riviera, Santo André - SP;-23,745232;-46,495771;Av. Sapopemba, 1557 - Vila Camilopolis, Santo André - SP, 09250-301;-23,615294;-46,521905;Praça do Carmo, 171 - Centro, Santo André - SP, 09010-020;-23,657456;-46,526114
35;3549904;354990;SÃO JOSÉ DOS CAMPOS;713943;Av. Shishima Hifumi, 2911 - Urbanova, São José dos Campos - SP, 12244-390;-23,1958672;-45,9713018;R. Quebra-Eixo, 07 - Portal do Céu, São José dos Campos - SP, 12226-211;-23,1955336;-45,7796034;Av. Napoleão Bonaparte - Jardim Imperial, São José dos Campos - SP, 12234-320;-23,2884915;-45,8945026;Av. Maria Cândida Delgado, 290 - Vila Candida, São José dos Campos - SP;-23,1455533;-45,9038386;R. José de Alencar, 123 - Centro, São José dos Campos - SP, 12209-530;-23,184819;-45,878729
26;2607901;260790;JABOATÃO DOS GUARARAPES;697636;Rua José de Alencar, 148 - PE-007 - Usina Bulhões, Jaboatão dos Guararapes - PE, 54080-050;-8,112727;-35,032122;R. Argentina Castelo Branco, 140-222 - Piedade, Jaboatão dos Guararapes - PE, 54410-030;-8,167662;-34,914281;R. Três, 1576-1764 - Barra de Jangada, Jaboatão dos Guararapes - PE, 54440-410;-8,24071;-34,940838;R. Remígio, 76 - Boa Viagem, Recife - PE, 51210-030;-8,14235;-34,916851;Av. Barreto de Menezes, 1648 - Prazeres, Jaboatão dos Guararapes - PE, 54310-310;-8,16398;-34,922287
35;3534401;353440;OSASCO;696850;R. Luís Henrique de Oliveira, 89 - São Pedro, Osasco - SP, 06186-134;-23,525239;-46,814919;Av. Manoel Pedro Pímentel, 215 - Continental, Osasco - SP, 06020-194;-23,535379;-46,761663;Av. Victor Civita, 920-1006 - Conceicao, Osasco - SP, 06140-270;-23,584333;-46,806474;Av. Dr. Mauro Lindemberg Monteiro, 126 - Industrial Anhangüera, Osasco - SP, 06278-010;-23,481867;-46,773635;Av. Bussocaba, 300 - Centro, Osasco - SP, 06023-020;-23,541791;-46,772825
35;3543402;354340;RIBEIRÃO PRETO;694534;Av. Bandeirantes, 2905 - Vila Virginia, Ribeirão Preto - SP, 14030-670;-21,176715;-47,850877;R. Mirian Strambi, 145 - Recreio Anhanguera, Ribeirão Preto - SP, 14097-052;-21,208449;-47,752125;Rod. José Fregonezi, 3675 - Distrito de Bonfim Paulista, Ribeirão Preto - SP, 14110-000;-21,251338;-47,818536;Av. Antônio da Costa Santos, 335 - Rodovia Anhanguera, Ribeirão Preto - SP, 14040-800;-21,093297;-47,79788;R. Álvares Cabral, 370 - Centro, Ribeirão Preto - SP, 14015-040;-21,174531;-47,809555
31;3170206;317020;UBERLÂNDIA;683247;Rua Rio Mojiguaçu, 336 - Mansour, Uberlândia - MG, 38414-460;-18,9369619;-48,340788;R. Facão, 93 - Morumbi, Uberlândia - MG, 38407-132;-18,9196479;-48,2092205;Av. Nicomedes Alves dos Santos, 7200 - Shopping Park, Uberlândia - MG, 38425-377;-18,9801894;-48,2764025;Av. Aírton Borges da Silva, 1530 - Distrito Industrial, Uberlândia - MG, 38401-315;-18,8627123;-48,282948;Av. João Pessoa, 221 - Martins, Uberlândia - MG, 38400-338;-18,913462;-48,276363
35;3552205;355220;SOROCABA;671186;Av. Dr. Américo Figueiredo, 4790 - Jardim Santa Barbara, Sorocaba - SP, 18053-000;-23,50132;-47,5248565;Av. São Paulo, 5450 - Jardim Santa Rosália, Sorocaba - SP, 18013-000;-23,4950139;-47,4181176;Rod. João Leme dos Santos, 75 - Parque Vereda Bandeirantes, Sorocaba - SP, 18052-780;-23,5396046;-47,4702239;R. Mariano Vera Dias, 221 - Parque Vitoria Regia, Sorocaba - SP, 18078-420;-23,4357582;-47,4690381;R. Cel. Benedito Píres, 34 - Centro, Sorocaba - SP, 18010-160;-23,500364;-47,458111
31;3118601;311860;CONTAGEM;659070;Via Expressa de Contagem, 12900 - Sapucaias III, Contagem - MG, 32070-385;-19,9255238;-44,1296417;R. Santa Teresinha, 25 - Vila Darci Vargas, Contagem - MG, 32372-170;-19,9281418;-44,0291985;Av. Coronel Benjamim Guimarães, 179 - Industrial, Contagem - MG, 32235-000;-19,9809647;-44,0397496;Av. Wilson Tavares Ribeiro, 1.400 - Chacaras Reunidas Santa Terezinha, Contagem - MG, 32183-680;-19,8657314;-44,0529138;Praça Presidente Tancredo Neves, 200 - Camilo Alves, Contagem - MG, 32017-900;-19,919166;-44,092684
28;2800308;280030;ARACAJU;648939;Av. Chanceler Osvaldo Aranha, 3090 - Novo Paraíso, Aracaju - SE, 49092-545;-10,905765;-37,102017;SE-100, 118-170 - Treze de Julho, Aracaju - SE, 49020-010;-10,926716;-37,043586;Av. Dr. José Domingos Maia, 10 - Mosqueiro, Aracaju - SE, 49009-010;-11,0951576;-37,14591;Av. Gen. Euclídes Figueiredo, 2829 - Porto D'antas, Aracaju - SE, 49067-016;-10,8780677;-37,0755911;Rua Itabaiana, 14 - Centro, Aracaju - SE, 49010-170;-10,913004;-37,050298
29;2910800;291080;FEIRA DE SANTANA;609913;Av. Rio de Janeiro, 1.565 - Pedra do Descanso, Feira de Santana - BA, 44007-775;-12,2667249;-38,9868649;44085-052, Av. Nóide Cerqueira, 5560 - Sim, Feira de Santana - BA, 44085-052;-12,2618458;-38,9225379;Galpão B - R. Baneb, 133 - Cis Tomba, Feira de Santana - BA, 44010-820;-12,3003607;-38,9567493;Av. Frei Félix de Pacauba, 3642 - Novo Horizonte, Feira de Santana - BA, 44036-331;-12,1536315;-38,9708406;Av. Monsenhor Mario Pessoa, 27 - Centro, Feira de Santana - BA, 44001-775;-12,258693;-38,967921
51;5103403;510340;CUIABÁ;607153;Av. Ciríaco Cândia, 586 - Cidade Verde, Cuiabá - MT, 78028-770;-15,6078769;-56,1344976;R. dos Trabalhadores, 2772 - Carumbé, Cuiabá - MT, 78035-070;-15,5610438;-56,0116969;Rod. dos Imigrantes, 8 - Novo Mato Grosso, Cuiabá - MT;-15,6978597;-56,0429036;Av. dos Florais, 1044 - Condominio Florais Cuiaba Res., Cuiabá - MT, 78049-400;-15,5347061;-56,0997559;Praça Alencastro, 158 - Centro, Cuiabá - MT, 78005-906;-15,596721;-56,095784
42;4209102;420910;JOINVILLE;583144;R. Quinze de Novembro, 8763 - Vila Nova, Joinville - SC, 89237-800;-26,2945709;-48,9252775;R. Pte. Serrada, 240 - Comasa, Joinville - SC, 89207-595;-26,28317;-48,8029748;R. Laura Auler, 730 - Santa Catarina, Joinville - SC, 89233-200;-26,3699531;-48,8462582;Av. Rolf Wiest, 333 - Bom Retiro, Joinville - SC, 89223-005;-26,2561757;-48,8651411;Av. Hermann August Lepper, 10 - Centro, Joinville - SC, 89221-005;-26,30116;-48,841293
52;5201405;520140;APARECIDA DE GOIÂNIA;565957;Av. Nossa Sra. Aparecida, 4 - Quadra 25 Lote 22 sala - Jardim Alto Paraiso, Aparecida de Goiânia - GO, 74948-110;-16,806662;-49,358929;Alameda Antônio Elías de Deus, 1007-997 - Lot. Real Grandeza, Aparecida de Goiânia - GO, 74988-818;-16,825417;-49,213684;Av. das Nações, 616 - Centro, Aparecida de Goiânia - GO, 74976-190;-16,827807;-49,2487782;74915-420, Av. Rio Verde, 2574 - Parque Amazonia, Aparecida de Goiânia - GO, 74840-150;-16,7543691;-49,293664;Av. Francisco Inácio Ferreira - Res. Solar Central Park, Aparecida de Goiânia - GO, 74968-507;-16,816459;-49,255379
31;3136702;313670;JUIZ DE FORA;564310;R. Bartolomeu dos Santos, 385-337 - São Damião, Juiz de Fora - MG, 36088-514;-21,703541;-43,44501;R. Henrique Pimenta Brasiel, 42 - Jardim Esperanca, Juiz de Fora - MG, 36072-270;-21,771943;-43,293661;Av. Deusdedit Salgado, 2200 - Salvaterra, Juiz de Fora - MG, 36033-007;-21,8060677;-43,3753902;R. Antônio Tristão, 52 - Bandeirantes, Juiz de Fora - MG, 36047-160;-21,7218836;-43,3627066;Av. Barão do Rio Branco, 2234 - Centro, Juiz de Fora - MG, 36015-510;-21,761536;-43,349731
41;4113700;411370;LONDRINA;563943;R. Sinode Bighinati, 266 - C H Avelino Vieira, Londrina - PR, 86056-160;-23,319267;-51,226843;R. Leci Suzana García, 21 - C. H. Ernani de Moura Lima 1, Londrina - PR, 86037-220;-23,328703;-51,105353;Av. Pres. Euríco Gáspar Dutra, 1300 - Cafezal, Londrina - PR, 86049-090;-23,3716074;-51,1559715;Av. Bento Amaral Monteiro, 1896 - Jd. Strass, Londrina - PR, 86084-830;-23,2475304;-51,1498507;Av. Duque de Caxias, 635 - Centro Cívico, Londrina - PR, 86060-280;-23,335272;-51,149922
15;1500800;150080;ANANINDEUA;525566;BR-316, 1001 - Guanabara, Ananindeua - PA, 67013-000;-1,3959156;-48,4240357;Rodovia BR 316 km 09,1760 - Centro, Ananindeua - PA, 67033-000;-1,3668318;-48,3698262;601, R. Osvaldo Cruz - Águas Lindas, Belém - PA, 67118-270;-1,401966;-48,3999256;R. Manoel Rosa, 1487 - Curuçambá, Ananindeua - PA, 67000-000;-1,321625;-48,3989543;R. Cláudio Sanders, 630 - Centro, Ananindeua - PA, 67030-325;-1,361539;-48,374619
11;1100205;110020;PORTO VELHO;519531;R. Dom Pedro II, 485 - Caiari, Porto Velho - RO, 76804-091;-8,7667008;-63,9090605;R. Raimundo Cantuária, 10762-10764, Porto Velho - RO, 76828-690;-8,7539022;-63,8184287;R. Joaquim da Rocha, 4790 - Caladinho, Porto Velho - RO, 78000-900;-8,7996228;-63,8720506;Av. Rio Madeira, 6739 - Nova Esperança, Porto Velho - RO, 76822-480;-8,7218638;-63,8801139;Rua Josè de Alencar, 2638 - Centro, Porto Velho - RO, 76801-073;-8,765279;-63,905208
33;3303302;330330;NITERÓI;511786;R. Gen. Osório, 250 - São Domingos, Niterói - RJ, 24020-005;-22,9060412;-43,1289354;Av. Araken Domingues Costa, 12 - Santa Barbara, Niterói - RJ, 24141-333;-22,8872901;-43,0561102;Estrada Francisco da Cruz Nunes, 5428 - Itaipu, Niterói - RJ, 24350-200;-22,9356564;-43,0707646;Av. do Contôrno, 16 - Barreto, Niterói - RJ, 24110-205;-22,8680614;-43,1039381;Av. Visconde do Rio Branco, 254-308 - Centro, Niterói - RJ, 24020-005;-22,890931;-43,1238
33;3300456;330045;BELFORD ROXO;508614;Rua Marly dos Santos Garces, 75 - Andrade Araujo, Belford Roxo - RJ, 26130-693;-22,7484897;-43,4215098;R. Francisco Monteiro, 555 - Lote XV, Belford Roxo - RJ, 26183-490;-22,713553;-43,3251165;Av Jorge Julio da Costa dos Santos, 200 - Centro, Belford Roxo - RJ, 26130-010;-22,7715621;-43,3996967;Caminho do Jango, 13 - Recantus, Belford Roxo - RJ, 26155-370;-22,7111561;-43,4034555;Av. Benjamin Pinto Dias, 1753 - Centro, Belford Roxo - RJ, 26112-025;-22,760847;-43,403473
32;3205002;320500;SERRA;507598;Av. Dido Fontes, 90 - Jardim Tropical, Serra - ES, 29167-183;-20,2074232;-40,2744064;Av. Atapoã, 607 - Manguinhos, Serra - ES, 29173-000;-20,192399;-40,190922;Av. Pres. Castelo Branco, 661 - Carapina Grande, Serra - ES, 29160-060;-20,23616;-40,277264;R. Gov. Valadares, 446-572 - Divinópolis, Serra - ES, 29177-241;-20,109763;-40,324471;R. Maestro Antônio Cícero, 111 - Caçaroca, Serra - ES, 29176-100;-20,124284;-40,305298
43;4305108;430510;CAXIAS DO SUL;504069;Rodovia RSC 453, 16685 - Desvio Rizzo, Caxias do Sul - RS, 95110-311;-29,1896046;-51,2441121;R. Porto Belo, 1617 - São Luiz, Caxias do Sul - RS;-29,1651099;-51,1214488;R. Egide Bressan Sartor, 21 A - Nossa Sra. das Graças, Caxias do Sul - RS, 95095-151;-29,2101799;-51,1972428;Estr. Ver. Ari Antônio Bergoza, 1448 - Linha 40, Caxias do Sul - RS, 95010-060;-29,1194332;-51,2048287;R. Ernesto Alves, 1118 - Centro, Caxias do Sul - RS, 95020-360;-29,163752;-51,172721
33;3301009;330100;CAMPOS DOS GOYTACAZES;503424;R. Dr. Álvaro Grain, 118 - Parque Corrientes, Campos dos Goytacazes - RJ, 28053-593;-21,7463426;-41,3595237;Av. Alberto Lamego, 846 - Parque California, Campos dos Goytacazes - RJ, 28016-812;-21,7591868;-41,3073501;Av. José Alves de Azevedo, 1397 - Rosário, Campos dos Goytacazes - RJ, 28035-611;-21,7856188;-41,3378116;Estr. Brejo Grande, 67 - Parque Aeroporto, Campos dos Goytacazes - RJ, 28093-000;-21,6997658;-41,3134473;R. Mal. Floriano, 224 - Centro, Campos dos Goytacazes - RJ, 28010-162;-21,762567;-41,320585
16;1600303;160030;MACAPÁ;493634;Rod. Duque de Caxias, 11408-11462, Macapá - AP;0,036292;-51,134295;Praça Zaguri, 1417-1297, Macapá - AP;0,035219;-51,04816;R. Canal das Pedrinhas, 443 - Pedrinhas, Macapá - AP, 68903-660;-0,004069;-51,0783907;Av. Glicério Souza Figueiredo, 1 - Jardim Felicidade, Macapá - AP, 68909-821;0,0992729;-51,0633453;R. Cândido Mendes, 344 - Central, Macapá - AP, 68905-670;0,031034;-51,051027
42;4205407;420540;FLORIANÓPOLIS;492977;Av. Gov. Ivo Silveira, Nº 3773 - Capoeiras, Florianópolis - SC, 88085-002;-27,6010198;-48,6034607;Rod. Jorn. Manoel de Menezes, 1056 - Barra da Lagoa, Florianópolis - SC, 88061-701;-27,603586;-48,4374486;Balneário dos, R. Waldemar de Melo Dias, 93 - Açores, Florianópolis - SC, 88067-340;-27,7833875;-48,5254394;R. Cônego Valmor Castro, 270 - Ponta das Canas, Florianópolis - SC;-27,3928673;-48,4321955;R. Ten. Silveira, 60 - Centro, Florianópolis - SC, 88010-300;-27,596579;-48,550022
32;3205200;320520;VILA VELHA;486208;Av. Otávio Borin, 1048-1158 - Nova América, Vila Velha - ES, 29111-866;-20,348131;-40,354893;R. Dr. Lúcio Waem Pereira, 1-47 - Praia da Costa, Vila Velha - ES, 29101-040;-20,32511;-40,268679;Av. Antônio Leite, 224 - Ponta da Fruta, Vila Velha - ES, 29124-080;-20,5163999;-40,3685144;000, Av. Capuaba, 21 - Ataíde, Vila Velha - ES, 29119-000;-20,329912;-40,329424;R. Delmar Duarte, 7 - Centro de Vila Velha, Vila Velha - ES, 29100-210;-20,330582;-40,29221
33;3305109;330510;SÃO JOÃO DE MERITI;471888;R. Elizário de Souza, 586 - Vila Norma, São João de Meriti - RJ, 25535-360;-22,7924776;-43,4055638;6M99+GC Jardim Sumare, São João de Meriti - RJ;-22,7816121;-43,3389467;Av. Nossa Sra. das Graças, 222 - Centro, São João de Meriti - RJ, 25515-001;-22,7997714;-43,3688753;Av. Automóvel Clube, 4720 - Jardim Noya, São João de Meriti - RJ, 25561-170;-22,765708;-43,3657444;Av. Nossa Sra. das Graças, 460 - Centro, São João de Meriti - RJ, 25515-001;-22,801831;-43,370424
